{
  "algorithm": "sa",
  "experiment_id": "kdc-smoke20-all-registered-final-20261012T074200",
  "instance_id": "eil51-f6e4afd67825-e956423838",
  "objective": "minmax",
  "repeat": 0,
  "requested_backend": "auto",
  "rerun_of": null,
  "resolved_configuration": {
    "actual_threads": 1,
    "actual_time_limit_sec": 5.0,
    "algorithm_category": "heuristic",
    "backend_capabilities": {},
    "backend_detection": {
      "actual": "branch-and-bound",
      "requested": "auto",
      "selected": "branch-and-bound"
    },
    "benchmark_profile": "DEBUG",
    "brute_force_max_assignments": 100000,
    "brute_force_time_limit_sec": 0.5,
    "dataset_profile": "smoke20",
    "diagnostic_max_assignments": null,
    "exact_time_limit_sec": 10.0,
    "experiment_label": "smoke / development validation",
    "fast_time_limit_sec": 5.0,
    "minmax_budget_fraction": 0.5,
    "minsum_budget_fraction": 0.5,
    "minsum_refinement_policy": "adaptive",
    "per_static_time_limit_sec": 2.0,
    "reference_designated": false,
    "requested_algorithm": "sa",
    "requested_backend": "auto",
    "requested_threads": 2,
    "requested_time_limit_sec": 5.0,
    "resolved_algorithm": "sa",
    "selected_backend": "branch-and-bound"
  },
  "run_id": "run_20261012T041944Z__sa__minmax__eil51-f6e4afd67825-e956423838__r00__08ede09d88d7",
  "run_key": "4494b7c7dae0204ab3ac869fdf6e18e482211372f4b1d9f7dca4fee269daf24f",
  "schema_version": 1,
  "seed": 42
}
