{
  "algorithm": "primal-dual",
  "experiment_id": "kdc-smoke20-all-registered-final-20261012T074200",
  "instance_id": "C-right-8bf4b5770668-e0f2e6a705",
  "objective": "minsum",
  "repeat": 0,
  "requested_backend": "auto",
  "rerun_of": null,
  "resolved_configuration": {
    "actual_threads": 1,
    "actual_time_limit_sec": 5.0,
    "algorithm_category": "heuristic",
    "backend_capabilities": {},
    "backend_detection": {
      "actual": "branch-and-bound",
      "requested": "auto",
      "selected": "branch-and-bound"
    },
    "benchmark_profile": "DEBUG",
    "brute_force_max_assignments": 100000,
    "brute_force_time_limit_sec": 0.5,
    "dataset_profile": "smoke20",
    "diagnostic_max_assignments": null,
    "exact_time_limit_sec": 10.0,
    "experiment_label": "smoke / development validation",
    "fast_time_limit_sec": 5.0,
    "minmax_budget_fraction": 0.5,
    "minsum_budget_fraction": 0.5,
    "minsum_refinement_policy": "adaptive",
    "per_static_time_limit_sec": 2.0,
    "reference_designated": false,
    "requested_algorithm": "primal-dual",
    "requested_backend": "auto",
    "requested_threads": 2,
    "requested_time_limit_sec": 5.0,
    "resolved_algorithm": "primal-dual",
    "selected_backend": "branch-and-bound"
  },
  "run_id": "run_20261012T041938Z__primal-dual__minsum__C-right-8bf4b5770668-e0f2e6a705__r00__185a9acb7ac1",
  "run_key": "bd46c44e6cb20533e76e33f74bd20b2d8fb30f06c52d1a97e487dcb612c7ab14",
  "schema_version": 1,
  "seed": 42
}
