{
  "algorithm": "greedy",
  "experiment_id": "minmax-correctness-20261006-run01",
  "instance_id": "eil51-e956423838",
  "objective": "minmax",
  "repeat": 0,
  "requested_backend": "auto",
  "rerun_of": null,
  "resolved_configuration": {
    "actual_threads": 1,
    "actual_time_limit_sec": 5.0,
    "backend_capabilities": {},
    "backend_detection": {
      "actual": "branch-and-bound",
      "requested": "auto",
      "selected": "branch-and-bound"
    },
    "benchmark_profile": "DEBUG",
    "dataset_profile": "smoke10",
    "exact_time_limit_sec": 10.0,
    "experiment_label": "smoke / development validation",
    "fast_time_limit_sec": 5.0,
    "minsum_refinement_policy": "adaptive",
    "per_static_time_limit_sec": 2.0,
    "requested_algorithm": "greedy",
    "requested_backend": "auto",
    "requested_threads": 2,
    "requested_time_limit_sec": 5.0,
    "resolved_algorithm": "greedy",
    "selected_backend": "branch-and-bound"
  },
  "run_id": "run_20261006T023521Z__greedy__minmax__eil51-e956423838__r00__07ec082f8801",
  "run_key": "c2d66cd4f6a2905f32096e81baa00b9fe9c89f450bc049ccbc13c72f4ffc78c3",
  "schema_version": 1,
  "seed": 42
}
