{
  "algorithm": "greedy",
  "experiment_id": "kdc-smoke20-all-registered-final-20261012T074200",
  "instance_id": "st70-fa79167d4566-93e4a763b9",
  "objective": "minmax",
  "repeat": 0,
  "requested_backend": "auto",
  "rerun_of": null,
  "resolved_configuration": {
    "actual_threads": 1,
    "actual_time_limit_sec": 5.0,
    "algorithm_category": "heuristic",
    "backend_capabilities": {},
    "backend_detection": {
      "actual": "branch-and-bound",
      "requested": "auto",
      "selected": "branch-and-bound"
    },
    "benchmark_profile": "DEBUG",
    "brute_force_max_assignments": 100000,
    "brute_force_time_limit_sec": 0.5,
    "dataset_profile": "smoke20",
    "diagnostic_max_assignments": null,
    "exact_time_limit_sec": 10.0,
    "experiment_label": "smoke / development validation",
    "fast_time_limit_sec": 5.0,
    "minmax_budget_fraction": 0.5,
    "minsum_budget_fraction": 0.5,
    "minsum_refinement_policy": "adaptive",
    "per_static_time_limit_sec": 2.0,
    "reference_designated": false,
    "requested_algorithm": "greedy",
    "requested_backend": "auto",
    "requested_threads": 2,
    "requested_time_limit_sec": 5.0,
    "resolved_algorithm": "greedy",
    "selected_backend": "branch-and-bound"
  },
  "run_id": "run_20261012T042129Z__greedy__minmax__st70-fa79167d4566-93e4a763b9__r00__83f88b5fd18c",
  "run_key": "7cb7448e7da8b1f048c7ca173ec9d2bf770847d0e948f80b84f036c506627657",
  "schema_version": 1,
  "seed": 42
}
