{
  "algorithm": "nn",
  "experiment_id": "kdc-smoke20-all-registered-final-20261012T074200",
  "instance_id": "euro-night-0000030-e7069adc74e0-164a859873",
  "objective": "minsum",
  "repeat": 0,
  "requested_backend": "auto",
  "rerun_of": null,
  "resolved_configuration": {
    "actual_threads": 1,
    "actual_time_limit_sec": 5.0,
    "algorithm_category": "heuristic",
    "backend_capabilities": {},
    "backend_detection": {
      "actual": "branch-and-bound",
      "requested": "auto",
      "selected": "branch-and-bound"
    },
    "benchmark_profile": "DEBUG",
    "brute_force_max_assignments": 100000,
    "brute_force_time_limit_sec": 0.5,
    "dataset_profile": "smoke20",
    "diagnostic_max_assignments": null,
    "exact_time_limit_sec": 10.0,
    "experiment_label": "smoke / development validation",
    "fast_time_limit_sec": 5.0,
    "minmax_budget_fraction": 0.5,
    "minsum_budget_fraction": 0.5,
    "minsum_refinement_policy": "adaptive",
    "per_static_time_limit_sec": 2.0,
    "reference_designated": false,
    "requested_algorithm": "nn",
    "requested_backend": "auto",
    "requested_threads": 2,
    "requested_time_limit_sec": 5.0,
    "resolved_algorithm": "nn",
    "selected_backend": "branch-and-bound"
  },
  "run_id": "run_20261012T042004Z__nn__minsum__euro-night-0000030-e7069adc74e0-164a85__r00__4fb1a156e6bc",
  "run_key": "ce74ad50423b330cdbabb5748de6a0ef6d3d6bda3bd88f87c2dffda781327a60",
  "schema_version": 1,
  "seed": 42
}
