{
  "algorithm": "branch-and-bound",
  "experiment_id": "kdc-smoke20-all-registered-final-20261012T074200",
  "instance_id": "gr96-a23a7ba30c4c-e195dfa06d",
  "objective": "minmax",
  "repeat": 0,
  "requested_backend": "auto",
  "rerun_of": null,
  "resolved_configuration": {
    "actual_threads": 1,
    "actual_time_limit_sec": 10.0,
    "algorithm_category": "exact_reference",
    "backend_capabilities": {},
    "backend_detection": {
      "actual": "branch-and-bound",
      "requested": "auto",
      "selected": "branch-and-bound"
    },
    "benchmark_profile": "DEBUG",
    "brute_force_max_assignments": 100000,
    "brute_force_time_limit_sec": 0.5,
    "dataset_profile": "smoke20",
    "diagnostic_max_assignments": null,
    "exact_time_limit_sec": 10.0,
    "experiment_label": "smoke / development validation",
    "fast_time_limit_sec": 5.0,
    "minmax_budget_fraction": 0.5,
    "minsum_budget_fraction": 0.5,
    "minsum_refinement_policy": "adaptive",
    "per_static_time_limit_sec": 2.0,
    "reference_designated": true,
    "requested_algorithm": "branch-and-bound",
    "requested_backend": "auto",
    "requested_threads": 2,
    "requested_time_limit_sec": 10.0,
    "resolved_algorithm": "branch-and-bound",
    "selected_backend": "branch-and-bound"
  },
  "run_id": "run_20261012T042004Z__branch-and-bound__minmax__gr96-a23a7ba30c4c-e195dfa06d__r00__12e059d7368c",
  "run_key": "4d794ed52504d3fdd92a691a15ff1c74eb3f7e72a50573f1635456cf13c77d7e",
  "schema_version": 1,
  "seed": 42
}
