{
  "algorithm": "genetic",
  "experiment_id": "kdc-smoke20-all-registered-final-20261012T074200",
  "instance_id": "eil76-e404104dd7bb-8eb626a3b8",
  "objective": "minmax",
  "repeat": 0,
  "requested_backend": "auto",
  "rerun_of": null,
  "resolved_configuration": {
    "actual_threads": 1,
    "actual_time_limit_sec": 5.0,
    "algorithm_category": "heuristic",
    "backend_capabilities": {},
    "backend_detection": {
      "actual": "branch-and-bound",
      "requested": "auto",
      "selected": "branch-and-bound"
    },
    "benchmark_profile": "DEBUG",
    "brute_force_max_assignments": 100000,
    "brute_force_time_limit_sec": 0.5,
    "dataset_profile": "smoke20",
    "diagnostic_max_assignments": null,
    "exact_time_limit_sec": 10.0,
    "experiment_label": "smoke / development validation",
    "fast_time_limit_sec": 5.0,
    "minmax_budget_fraction": 0.5,
    "minsum_budget_fraction": 0.5,
    "minsum_refinement_policy": "adaptive",
    "per_static_time_limit_sec": 2.0,
    "reference_designated": false,
    "requested_algorithm": "genetic",
    "requested_backend": "auto",
    "requested_threads": 2,
    "requested_time_limit_sec": 5.0,
    "resolved_algorithm": "genetic",
    "selected_backend": "branch-and-bound"
  },
  "run_id": "run_20261012T041947Z__genetic__minmax__eil76-e404104dd7bb-8eb626a3b8__r00__f9336b4b9713",
  "run_key": "32a3f53cc2e8c869058fbe210778fc03da3a0fb22cc900fad245cf9753c706d7",
  "schema_version": 1,
  "seed": 42
}
