{
  "algorithm": "local-search",
  "experiment_id": "kdc-smoke20-all-registered-final-20261012T074200",
  "instance_id": "rat99-a364923ee329-1be1f1f758",
  "objective": "minsum",
  "repeat": 0,
  "requested_backend": "auto",
  "rerun_of": null,
  "resolved_configuration": {
    "actual_threads": 1,
    "actual_time_limit_sec": 5.0,
    "algorithm_category": "heuristic",
    "backend_capabilities": {},
    "backend_detection": {
      "actual": "branch-and-bound",
      "requested": "auto",
      "selected": "branch-and-bound"
    },
    "benchmark_profile": "DEBUG",
    "brute_force_max_assignments": 100000,
    "brute_force_time_limit_sec": 0.5,
    "dataset_profile": "smoke20",
    "diagnostic_max_assignments": null,
    "exact_time_limit_sec": 10.0,
    "experiment_label": "smoke / development validation",
    "fast_time_limit_sec": 5.0,
    "minmax_budget_fraction": 0.5,
    "minsum_budget_fraction": 0.5,
    "minsum_refinement_policy": "adaptive",
    "per_static_time_limit_sec": 2.0,
    "reference_designated": false,
    "requested_algorithm": "local-search",
    "requested_backend": "auto",
    "requested_threads": 2,
    "requested_time_limit_sec": 5.0,
    "resolved_algorithm": "local-search",
    "selected_backend": "branch-and-bound"
  },
  "run_id": "run_20261012T042105Z__local-search__minsum__rat99-a364923ee329-1be1f1f758__r00__93c640ecb273",
  "run_key": "4ce9989d63afc8dcdf3c870045219b2a21f5b3066de00e3050e63a916755d006",
  "schema_version": 1,
  "seed": 42
}
