{
  "algorithm": "greedy",
  "experiment_id": "algorithm-smoke-20261005-complete",
  "instance_id": "eil51-e956423838",
  "objective": "minsum",
  "repeat": 0,
  "requested_backend": "auto",
  "rerun_of": null,
  "resolved_configuration": {
    "actual_threads": 1,
    "actual_time_limit_sec": 5.0,
    "backend_capabilities": {},
    "backend_detection": {
      "actual": "branch-and-bound",
      "requested": "auto",
      "selected": "branch-and-bound"
    },
    "benchmark_profile": "DEBUG",
    "dataset_profile": "smoke10",
    "exact_time_limit_sec": 10.0,
    "experiment_label": "smoke / development validation",
    "fast_time_limit_sec": 5.0,
    "minsum_refinement_policy": "adaptive",
    "per_static_time_limit_sec": 2.0,
    "requested_algorithm": "greedy",
    "requested_backend": "auto",
    "requested_threads": 2,
    "requested_time_limit_sec": 5.0,
    "resolved_algorithm": "greedy",
    "selected_backend": "branch-and-bound"
  },
  "run_id": "run_20261005T010718Z__greedy__minsum__eil51-e956423838__r00__9e7387b85599",
  "run_key": "a126cd9dfec1419898fc1b49d57ae150c0febf9050b0c3394faea2c384f10e20",
  "schema_version": 1,
  "seed": 42
}
