{
  "algorithm": "lp-rounding",
  "experiment_id": "kdc-smoke20-all-registered-final-20261012T074200",
  "instance_id": "kroD100-100b54b48d61-5062f763b8",
  "objective": "minmax",
  "repeat": 0,
  "requested_backend": "auto",
  "rerun_of": null,
  "resolved_configuration": {
    "actual_threads": 1,
    "actual_time_limit_sec": 5.0,
    "algorithm_category": "heuristic",
    "backend_capabilities": {},
    "backend_detection": {
      "actual": "branch-and-bound",
      "requested": "auto",
      "selected": "branch-and-bound"
    },
    "benchmark_profile": "DEBUG",
    "brute_force_max_assignments": 100000,
    "brute_force_time_limit_sec": 0.5,
    "dataset_profile": "smoke20",
    "diagnostic_max_assignments": null,
    "exact_time_limit_sec": 10.0,
    "experiment_label": "smoke / development validation",
    "fast_time_limit_sec": 5.0,
    "minmax_budget_fraction": 0.5,
    "minsum_budget_fraction": 0.5,
    "minsum_refinement_policy": "adaptive",
    "per_static_time_limit_sec": 2.0,
    "reference_designated": false,
    "requested_algorithm": "lp-rounding",
    "requested_backend": "auto",
    "requested_threads": 2,
    "requested_time_limit_sec": 5.0,
    "resolved_algorithm": "lp-rounding",
    "selected_backend": "branch-and-bound"
  },
  "run_id": "run_20261012T042019Z__lp-rounding__minmax__kroD100-100b54b48d61-5062f763b8__r00__91fa6af024ac",
  "run_key": "4487ff33d834668bfa342762ba738795f546e800a033c70829667fe81814b553",
  "schema_version": 1,
  "seed": 42
}
