{
  "algorithm": "nn",
  "experiment_id": "minmax-correctness-20261006-run03",
  "instance_id": "us-night-0000030.instance-3704ac03dc",
  "objective": "minmax",
  "repeat": 0,
  "requested_backend": "auto",
  "rerun_of": null,
  "resolved_configuration": {
    "actual_threads": 1,
    "actual_time_limit_sec": 5.0,
    "backend_capabilities": {},
    "backend_detection": {
      "actual": "branch-and-bound",
      "requested": "auto",
      "selected": "branch-and-bound"
    },
    "benchmark_profile": "DEBUG",
    "dataset_profile": "smoke10",
    "exact_time_limit_sec": 10.0,
    "experiment_label": "smoke / development validation",
    "fast_time_limit_sec": 5.0,
    "minsum_refinement_policy": "adaptive",
    "per_static_time_limit_sec": 2.0,
    "requested_algorithm": "nn",
    "requested_backend": "auto",
    "requested_threads": 2,
    "requested_time_limit_sec": 5.0,
    "resolved_algorithm": "nn",
    "selected_backend": "branch-and-bound"
  },
  "run_id": "run_20261006T024225Z__nn__minmax__us-night-0000030.instance-3704ac03dc__r00__ba4ce3796bdc",
  "run_key": "a0bc8819ce94e4ed8b1c89cc4a097fc85e63bff2d3c8e7cef6d3c15c925d55d7",
  "schema_version": 1,
  "seed": 42
}
