{
  "algorithm": "shifting",
  "experiment_id": "kdc-smoke20-all-registered-final-20261012T074200",
  "instance_id": "pr76-4001f85eab1a-dc636944a6",
  "objective": "minmax",
  "repeat": 0,
  "requested_backend": "auto",
  "rerun_of": "run_20261012T042047Z__shifting__minmax__pr76-4001f85eab1a-dc636944a6__r00__e95dd2764329",
  "resolved_configuration": {
    "actual_threads": 1,
    "actual_time_limit_sec": 5.0,
    "algorithm_category": "heuristic",
    "backend_capabilities": {},
    "backend_detection": {
      "actual": "branch-and-bound",
      "requested": "auto",
      "selected": "branch-and-bound"
    },
    "benchmark_profile": "DEBUG",
    "brute_force_max_assignments": 100000,
    "brute_force_time_limit_sec": 0.5,
    "dataset_profile": "smoke20",
    "diagnostic_max_assignments": null,
    "exact_time_limit_sec": 10.0,
    "experiment_label": "smoke / development validation",
    "fast_time_limit_sec": 5.0,
    "minmax_budget_fraction": 0.5,
    "minsum_budget_fraction": 0.5,
    "minsum_refinement_policy": "adaptive",
    "per_static_time_limit_sec": 2.0,
    "reference_designated": false,
    "requested_algorithm": "shifting",
    "requested_backend": "auto",
    "requested_threads": 2,
    "requested_time_limit_sec": 5.0,
    "resolved_algorithm": "shifting",
    "selected_backend": "branch-and-bound"
  },
  "run_id": "run_20261012T042911Z__shifting__minmax__pr76-4001f85eab1a-dc636944a6__r00__e025ab09d7cc",
  "run_key": "38bd6dfff5c0e1dd8f10dcc7566e52eee9127d0c46b9453d7934fa307fc122b5",
  "schema_version": 1,
  "seed": 42
}
